{
  "schema_version": "staff_runbook.v0",
  "runbook_id": "RB-REMOTE-VPN-720",
  "version_no": 1,
  "title": "VPN 오류 720 진단 및 대응",
  "language": "ko",
  "status": "DRAFT",
  "document_type": "STAFF_RUNBOOK",
  "data_split": "RAG",
  "is_synthetic": true,
  "service": {"service_id": "REMOTE_ACCESS", "component_id": "VPN"},
  "ownership": {"default_owner_department": "NETWORK", "supporting_departments": ["SYSTEM"]},
  "access": {"access_scope": "STAFF", "exposure_policy": "INTERNAL_ONLY", "ingest_status": "PENDING"},
  "tool_binding": {"status": "PENDING", "bound_step_ids": [], "note": "RasClient 이벤트와 네트워크 어댑터 binding을 읽는 MCP Tool 계약 확정 후 연결한다."},
  "scenario_validation": {"status": "NOT_RUN", "validated_at": null, "case_ids": []},
  "applicability": {
    "environment": "HOPS_VIRTUAL_COMPANY",
    "products": [
      {"name": "Windows", "version": "11"},
      {"name": "Windows Server RRAS", "version": "지원 버전"}
    ],
    "assumptions": [
      "가상 기업 직원은 회사가 배포한 Windows VPN 프로필을 사용한다.",
      "오류 720은 RasClient 이벤트 20227과 함께 확인한다.",
      "어댑터 binding 조회는 읽기 전용이며 변경·제거·재설치는 사람이 승인 후 수행한다.",
      "Agent는 관리자 PowerShell, 장치 제거 또는 서버 주소 풀 변경을 실행하지 않는다."
    ],
    "out_of_scope": [
      "오류 809·812 또는 인증서 오류",
      "PPTP·GRE 기반 레거시 VPN",
      "Agent가 WAN Miniport 재설치·binding 변경·DHCP 또는 RRAS 설정을 수행하는 작업"
    ]
  },
  "symptoms": [
    {
      "symptom_id": "SYM-01",
      "user_phrases": ["VPN 연결에서 오류 720이 떠요.", "원격 컴퓨터와 연결할 수 없고 네트워크 설정을 바꾸라고 나와요."],
      "observable_signals": ["RasClient 이벤트 ID 20227에 오류 720이 기록된다.", "WAN Miniport (IP) binding 또는 필터 드라이버 상태 확인이 필요하다."]
    },
    {
      "symptom_id": "SYM-02",
      "user_phrases": ["여러 사람의 VPN이 동시에 720 오류로 실패해요.", "VPN 연결은 시작되지만 IP를 받지 못하는 것 같아요."],
      "observable_signals": ["서버의 정적 IP pool 또는 RRAS용 DHCP scope 소진 후보가 있다.", "여러 클라이언트에서 같은 시간대 오류 720이 발생한다."]
    }
  ],
  "diagnostic_steps": [
    {
      "step_id": "DIA-01", "order": 1,
      "goal": "오류 720과 RasClient 이벤트를 확인한다.",
      "action": "발생 시각과 VPN 프로필 이름을 확인하고 Application 로그의 RasClient 이벤트 20227에서 오류 720인지 읽는다.",
      "safety_class": "READ_ONLY", "tool_query": null,
      "expected_signals": ["사용자 발생 시각과 RasClient 20227이 일치한다.", "반환 오류 코드가 720이다."],
      "on_match": "DIA-02에서 단일 단말과 공통 서버 장애를 구분한다.",
      "on_mismatch": "다른 VPN 오류 코드 런북으로 전환한다.",
      "evidence_ids": ["GE-012"]
    },
    {
      "step_id": "DIA-02", "order": 2,
      "goal": "클라이언트 binding 문제와 서버 IP 할당 문제를 구분한다.",
      "action": "같은 시간대 영향 사용자 수와 서버 IP pool·DHCP 가용성의 읽기 결과를 확인한다. 한 단말만 실패하면 WAN Miniport (IP)의 이름과 binding 상태를 조회한다.",
      "safety_class": "READ_ONLY", "tool_query": null,
      "expected_signals": ["여러 사용자의 공통 실패와 서버 주소 고갈이 함께 나타나거나, 단일 단말에서만 binding 이상이 나타난다.", "서버와 클라이언트 후보를 구분할 수 있다."],
      "on_match": "서버 문제면 CAUSE-01, 클라이언트 문제면 DIA-03으로 이동한다.",
      "on_mismatch": "필수 관측값이 없으면 원인을 단정하지 않고 NETWORK로 이관한다.",
      "evidence_ids": ["GE-012"]
    },
    {
      "step_id": "DIA-03", "order": 3,
      "goal": "WAN Miniport의 ARP binding과 제3자 필터를 구분한다.",
      "action": "Get-NetAdapter와 Get-NetAdapterBinding의 읽기 결과에서 WAN Miniport (IP), ms_wanarp 활성 상태, 제3자 필터 binding을 확인한다. Agent는 Enable·Disable 명령을 실행하지 않는다.",
      "safety_class": "READ_ONLY", "tool_query": null,
      "expected_signals": ["ms_wanarp가 비활성화되어 있거나 의심되는 제3자 필터가 binding되어 있다.", "둘 다 정상이면 Miniport 드라이버 손상 후보가 남는다."],
      "on_match": "CAUSE-02 또는 CAUSE-03 후보와 필요한 사람 조치를 기록한다.",
      "on_mismatch": "binding이 모두 정상이면 재설치 필요성을 사람이 판단하도록 이관한다.",
      "evidence_ids": ["GE-012"]
    }
  ],
  "cause_hypotheses": [
    {
      "cause_id": "CAUSE-01",
      "description": "RRAS 정적 IP pool, DHCP scope 또는 사용자 고정 IP를 할당할 수 없어 여러 연결이 실패한다.",
      "required_signals": ["여러 사용자에서 같은 시간대 오류 720", "서버 주소 pool·DHCP scope 소진 또는 고정 IP 할당 실패"],
      "required_signal_ids": ["SIG-034", "SIG-037", "SIG-039"],
      "contradictory_signals": ["서버 주소에 충분한 여유가 있음", "한 단말에서만 binding 이상이 확인됨"],
      "contradictory_signal_ids": ["SIG-038"],
      "owner_department": "NETWORK",
      "evidence_ids": ["GE-012"]
    },
    {
      "cause_id": "CAUSE-02",
      "description": "WAN Miniport (IP)의 Remote Access IP ARP Driver(ms_wanarp)가 비활성화되어 PPP IP 프로토콜을 구성하지 못한다.",
      "required_signals": ["오류 720", "WAN Miniport (IP)에서 ms_wanarp Enabled=false"],
      "required_signal_ids": ["SIG-034", "SIG-037", "SIG-038"],
      "contradictory_signals": ["ms_wanarp가 활성화됨", "여러 사용자에게 서버 주소 고갈이 확인됨"],
      "contradictory_signal_ids": ["SIG-039"],
      "owner_department": "SYSTEM",
      "evidence_ids": ["GE-012"]
    },
    {
      "cause_id": "CAUSE-03",
      "description": "제3자 네트워크 필터 binding 또는 WAN Miniport 드라이버 손상이 클라이언트 프로토콜 구성을 방해한다.",
      "required_signals": ["오류 720", "의심 필터 binding 또는 정상 binding에도 지속되는 Miniport 이상"],
      "required_signal_ids": ["SIG-034", "SIG-037", "SIG-055"],
      "contradictory_signals": ["다른 단말에서도 동시에 같은 오류 발생", "서버 주소 할당 실패가 확인됨"],
      "contradictory_signal_ids": ["SIG-039"],
      "owner_department": "SYSTEM",
      "evidence_ids": ["GE-012"]
    }
  ],
  "guidance_steps": [
    {
      "step_id": "GUID-01", "order": 1,
      "when": "오류 720이 확인된 경우",
      "instruction": "사용자에게 오류 코드·발생 시각·VPN 프로필 이름을 기록하고 VPN을 한 번만 다시 연결하도록 안내한다. 관리자 PowerShell이나 장치 관리자 작업은 안내하지 않는다.",
      "expected_user_result": "일시 오류인지 지속 오류인지 확인하고 진단에 필요한 최소 정보를 확보한다.",
      "if_not_resolved": "반복 시도를 중단하고 NETWORK로 이관한다.",
      "evidence_ids": ["GE-012"]
    },
    {
      "step_id": "GUID-02", "order": 2,
      "when": "binding·드라이버 또는 서버 주소 할당 점검이 필요한 경우",
      "instruction": "사용자에게 관리자 권한 점검이 필요하다고 안내하고, 임의 드라이버 삭제·보안 프로그램 해제·네트워크 설정 변경을 하지 않도록 알린다.",
      "expected_user_result": "사용자가 단말 상태를 유지한 채 담당자 원격 또는 현장 점검으로 이동한다.",
      "if_not_resolved": "NETWORK 티켓을 유지하고 필요 시 SYSTEM 협업을 요청한다.",
      "evidence_ids": ["GE-012"]
    }
  ],
  "staff_resolution_steps": [
    {
      "step_id": "RES-01", "order": 1, "actor": "IT_STAFF",
      "instruction": "영향 범위와 서버 IP pool·DHCP 상태를 확인하고, 단일 단말 문제이면 현재 WAN Miniport binding 구성을 보존한다.",
      "execution_mode": "HUMAN_ONLY", "approval_required": false,
      "verification": "서버 주소 할당 문제와 클라이언트 binding 문제 중 하나를 근거로 분류한다.",
      "rollback": null,
      "evidence_ids": ["GE-012"]
    },
    {
      "step_id": "RES-02", "order": 2, "actor": "IT_STAFF",
      "instruction": "ms_wanarp 비활성 또는 승인된 제3자 필터 문제가 확인되면 변경 전 상태를 기록하고 담당자 승인 후 해당 binding만 수정한다.",
      "execution_mode": "HUMAN_ONLY", "approval_required": true,
      "verification": "binding 상태가 정책값과 일치하고 오류 720 없이 연결된다.",
      "rollback": "새 네트워크 장애가 발생하면 기록한 이전 binding 상태로 복원한다.",
      "evidence_ids": ["GE-012"]
    },
    {
      "step_id": "RES-03", "order": 3, "actor": "IT_STAFF",
      "instruction": "binding 수정으로 해결되지 않고 서버 상태가 정상일 때만 변경 승인을 받아 WAN Miniport 장치를 재설치하고 네트워크 구성 변화를 기록한다.",
      "execution_mode": "HUMAN_ONLY", "approval_required": true,
      "verification": "재부팅 또는 장치 재검색 뒤 VPN 연결과 일반 네트워크가 모두 정상이다.",
      "rollback": "네트워크 기능이 악화되면 승인된 단말 복구 절차로 이전 드라이버·시스템 상태를 복원한다.",
      "evidence_ids": ["GE-012"]
    }
  ],
  "agent_handling": {"allowed_outcomes": ["GUIDE_USER", "HANDOFF"], "handoff_reasons": ["INSUFFICIENT_EVIDENCE", "GUIDANCE_NOT_RESOLVED"], "prohibited_actions": ["CODE_CHANGE", "CONFIG_CHANGE", "DEPLOY", "RESTART", "DB_WRITE"], "resolution_confirmation_sources": ["USER_CONFIRMATION", "BACKEND_STATE"]},
  "verification": {
    "success_signals": ["오류 720 없이 VPN 연결이 성공한다.", "사내 자원 접근과 일반 네트워크가 정상이다.", "사용자가 해결을 확인한다."],
    "failure_signals": ["오류 720이 재발한다.", "서버 주소 고갈이 계속된다.", "binding·드라이버 조치 후 다른 네트워크 기능이 실패한다."]
  },
  "escalation": {
    "triggers": ["오류 720 재발", "서버 IP pool·DHCP 확인 필요", "관리자 binding 변경 또는 Miniport 재설치 필요"],
    "target_department": "NETWORK",
    "evidence_to_attach": ["발생 시각·VPN 프로필·RasClient 20227", "동시 영향 사용자 수", "서버 주소 가용성 요약", "WAN Miniport binding 읽기 결과"]
  },
  "user_response": {
    "safe_summary_template": "VPN 오류 720을 확인하여 네트워크 담당 부서로 이관했습니다. 임의로 네트워크 장치나 드라이버를 제거하지 마세요.",
    "prohibited_details": ["관리자 PowerShell 변경 명령", "사용자·서버 IP 전체", "제3자 필터 내부 구성", "장치 제거를 직원이 직접 수행하라는 안내"]
  },
  "provenance": {"source_type": "SYNTHESIZED_FROM_PUBLIC_EVIDENCE", "source_evidence_ids": ["GE-012"], "created_at": "2026-10-26"},
  "review": {"content_status": "OWNER_CONFIRMED", "reviewer": "DATA_OWNER", "reviewed_at": "2026-10-26", "team_review_status": "PENDING"}
}
