{
  "schema_version": "staff_runbook.v0",
  "runbook_id": "RB-PORTAL-DB-LOCK",
  "version_no": 1,
  "title": "사내 포털 PostgreSQL Lock 및 Deadlock 진단 및 대응",
  "language": "ko",
  "status": "DRAFT",
  "document_type": "STAFF_RUNBOOK",
  "data_split": "RAG",
  "is_synthetic": true,
  "service": {"service_id": "PORTAL", "component_id": "PORTAL_DB"},
  "ownership": {"default_owner_department": "DB", "supporting_departments": ["BACKEND"]},
  "access": {"access_scope": "STAFF", "exposure_policy": "INTERNAL_ONLY", "ingest_status": "PENDING"},
  "tool_binding": {"status": "PENDING", "bound_step_ids": [], "note": "읽기 전용 MCP Tool 계약 확정 후 연결한다."},
  "scenario_validation": {"status": "NOT_RUN", "validated_at": null, "case_ids": []},
  "applicability": {
    "environment": "DEMO_PORTAL",
    "products": [{"name": "Spring Boot", "version": "4.1.1"}, {"name": "PostgreSQL", "version": "18"}],
    "assumptions": [
      "Demo Portal이 DB 세션에 application_name과 요청 상관 식별자를 남긴다.",
      "pg_stat_activity, pg_locks와 마스킹된 DB 로그를 읽기 전용으로 조회한다.",
      "PID, 사용자명, IP, SQL 원문과 바인딩 값은 Agent 응답에 노출하지 않는다.",
      "구체적인 MCP Tool ID는 아직 확정되지 않아 tool_query는 null이다."
    ],
    "out_of_scope": ["단순 slow query지만 lock wait 신호가 없는 장애", "DB 연결 한도 초과로 새 세션을 만들지 못하는 장애", "Agent가 트랜잭션 종료·세션 종료·SQL 수정·DB 설정 변경을 수행하는 작업"]
  },
  "symptoms": [
    {
      "symptom_id": "SYM-01",
      "user_phrases": ["강의 수강 완료 저장이 계속 멈춰 있어요.", "한 사용자가 수정 중이면 다른 사람의 저장이 안 돼요."],
      "observable_signals": ["요청 세션의 wait_event_type이 Lock이고 승인되지 않은 lock 대기가 존재한다.", "blocker가 종료되면 대기 요청이 진행된다."]
    },
    {
      "symptom_id": "SYM-02",
      "user_phrases": ["동시에 저장하면 한쪽에서 오류가 나요.", "저장 실패가 간헐적으로 발생하고 다시 하면 되는 경우가 있어요."],
      "observable_signals": ["PostgreSQL deadlock detected 오류가 기록되고 관련 트랜잭션 하나가 중단된다.", "서로 다른 트랜잭션이 반대 순서로 같은 자원을 잠근 흔적이 있다."]
    }
  ],
  "diagnostic_steps": [
    {
      "step_id": "DIA-01", "order": 1,
      "goal": "사용자 요청의 지연·실패와 DB 대기 또는 deadlock 로그를 연결한다.",
      "action": "X-Request-Id, 발생 시각, API 경로 템플릿으로 애플리케이션 로그와 마스킹된 PostgreSQL 로그를 비교한다.",
      "safety_class": "READ_ONLY", "tool_query": null,
      "expected_signals": ["같은 시간대 요청에서 Lock 대기 또는 deadlock 오류가 확인된다.", "일반 API 예외가 아니라 DB 트랜잭션 단계와 연결된다."],
      "on_match": "DIA-02에서 현재 대기 관계를 확인한다.",
      "on_mismatch": "lock 근거가 없으면 slow query 또는 애플리케이션 오류를 조사한다.",
      "evidence_ids": ["PE-021", "PE-022", "PE-028"]
    },
    {
      "step_id": "DIA-02", "order": 2,
      "goal": "대기 세션과 차단 세션의 관계를 확인한다.",
      "action": "pg_stat_activity와 pg_locks의 마스킹된 결과에서 waiter·blocker 식별자, wait_event_type, lock granted, 트랜잭션 시작 시각과 상태를 확인한다.",
      "safety_class": "READ_ONLY", "tool_query": null,
      "expected_signals": ["granted=false인 대기 lock과 충돌하는 blocker가 연결된다.", "대기 세션의 wait_event_type이 Lock이거나 관련 로그가 deadlock을 보고한다."],
      "on_match": "DIA-03에서 단방향 lock wait와 순환 deadlock을 구분한다.",
      "on_mismatch": "현재 대기가 사라졌다면 당시 로그를 사용하고, 로그도 없으면 근거 부족으로 이관한다.",
      "evidence_ids": ["PE-015", "PE-017"]
    },
    {
      "step_id": "DIA-03", "order": 3,
      "goal": "단순 lock wait와 deadlock을 구분한다.",
      "action": "대기 관계가 한 방향인지 순환인지, PostgreSQL이 deadlock을 감지해 한 트랜잭션을 중단했는지 확인한다.",
      "safety_class": "READ_ONLY", "tool_query": null,
      "expected_signals": ["단방향 대기이면 blocker 종료 후 waiter가 진행된다.", "deadlock이면 순환 대기와 자동 중단 오류가 확인된다."],
      "on_match": "CAUSE-01 또는 CAUSE-02로 분류한다.",
      "on_mismatch": "잠금 종류와 관계가 불명확하면 확정 원인 없이 DB로 이관한다.",
      "evidence_ids": ["PE-017", "PE-018", "PE-019"]
    },
    {
      "step_id": "DIA-04", "order": 4,
      "goal": "장기 열린 트랜잭션 또는 잠금 순서 문제의 근거를 정리한다.",
      "action": "트랜잭션 상태·시작 시각·application_name과 반복되는 대기 패턴을 마스킹 집계한다. log_lock_waits 시점은 deadlock_timeout과 함께 해석한다.",
      "safety_class": "READ_ONLY", "tool_query": null,
      "expected_signals": ["idle in transaction 또는 장기 트랜잭션이 blocker로 반복된다.", "deadlock 사례는 동일 자원의 반대 잠금 순서가 반복된다."],
      "on_match": "DB를 기본 담당으로 하고 코드 변경이 필요하면 BACKEND 협업을 표시한다.",
      "on_mismatch": "관측 시점 한계와 미수집 정보를 이관 근거에 명시한다.",
      "evidence_ids": ["PE-015", "PE-019", "PE-022", "PE-028"]
    }
  ],
  "cause_hypotheses": [
    {
      "cause_id": "CAUSE-01",
      "description": "장기 열린 트랜잭션 또는 동일 행을 점유한 세션 때문에 다른 쓰기 요청이 lock을 기다린다.",
      "required_signals": ["waiter와 단일 blocker 관계", "wait_event_type=Lock 또는 granted=false", "blocker 종료 뒤 waiter 진행"],
      "required_signal_ids": ["SIG-014", "SIG-015", "SIG-016"],
      "contradictory_signals": ["순환 대기와 deadlock detected 오류", "lock 대기 없이 실행시간만 김"],
      "contradictory_signal_ids": ["SIG-017"],
      "owner_department": "DB",
      "evidence_ids": ["PE-015", "PE-017", "PE-018", "PE-022"]
    },
    {
      "cause_id": "CAUSE-02",
      "description": "두 개 이상의 트랜잭션이 자원을 서로 다른 순서로 잠가 순환 대기가 발생했고 PostgreSQL이 한 트랜잭션을 중단했다.",
      "required_signals": ["순환 blocker·waiter 관계 또는 deadlock 로그", "PostgreSQL의 deadlock detected 오류", "관련 트랜잭션 중 하나의 자동 중단"],
      "required_signal_ids": ["SIG-015", "SIG-016", "SIG-017"],
      "contradictory_signals": ["한 방향 대기만 존재", "blocker 종료까지 기다린 뒤 오류 없이 완료"],
      "contradictory_signal_ids": ["SIG-014"],
      "owner_department": "DB",
      "evidence_ids": ["PE-019", "PE-021", "PE-028"]
    }
  ],
  "guidance_steps": [
    {
      "step_id": "GUID-01", "order": 1,
      "when": "deadlock으로 한 요청이 중단됐고 해당 업무가 안전하게 재시도 가능한 조회·멱등 작업인 경우",
      "instruction": "사용자에게 현재 화면을 새로 확인한 뒤 같은 동작을 한 번만 다시 시도하도록 안내한다. 결제·중복 저장 가능 작업에는 임의 재시도를 안내하지 않는다.",
      "expected_user_result": "중단된 트랜잭션 이후 잠금이 해제되었다면 요청이 정상 완료된다.",
      "if_not_resolved": "새 요청 ID와 시각을 첨부해 DB로 이관한다.",
      "evidence_ids": ["PE-019"]
    },
    {
      "step_id": "GUID-02", "order": 2,
      "when": "lock wait가 지속되거나 재시도 안전성을 확인할 수 없는 경우",
      "instruction": "사용자에게 데이터 저장 지연을 확인하여 DB 담당 부서로 이관했다고 안내하고 반복 저장을 중단하도록 요청한다.",
      "expected_user_result": "중복 작업 위험 없이 담당자 복구를 기다린다.",
      "if_not_resolved": "티켓 진행 상태를 안내하고 추가 조치를 반복하지 않는다.",
      "evidence_ids": ["PE-017", "PE-018", "PE-019"]
    }
  ],
  "staff_resolution_steps": [
    {
      "step_id": "RES-01", "order": 1, "actor": "IT_STAFF",
      "instruction": "마스킹된 대기 그래프와 업무 영향으로 blocker·waiter 관계를 확인하고, 정상 종료·커밋·롤백을 우선 조정한다.",
      "execution_mode": "HUMAN_ONLY", "approval_required": true,
      "verification": "차단 관계가 해소되고 대기 요청이 완료되거나 안전하게 실패 처리된다.",
      "rollback": null,
      "evidence_ids": ["PE-015", "PE-017", "PE-018"]
    },
    {
      "step_id": "RES-02", "order": 2, "actor": "IT_STAFF",
      "instruction": "업무 중단이 크고 정상 종료가 불가능한 경우에만 소유자·영향 범위를 확인해 세션 종료를 승인받는다. Agent는 이 작업을 실행하지 않는다.",
      "execution_mode": "HUMAN_ONLY", "approval_required": true,
      "verification": "종료 대상 외 정상 세션에 영향이 없고 대기 관계가 해소된다.",
      "rollback": "종료된 트랜잭션은 되돌릴 수 없으므로 실행 전 복구·재처리 계획을 확정한다.",
      "evidence_ids": ["PE-015", "PE-017"]
    },
    {
      "step_id": "RES-03", "order": 3, "actor": "IT_STAFF",
      "instruction": "반복 lock wait는 트랜잭션 범위를 줄이고, 반복 deadlock은 자원 잠금 순서를 일관되게 수정하거나 안전한 재시도 정책을 코드 리뷰 후 적용한다.",
      "execution_mode": "HUMAN_ONLY", "approval_required": true,
      "verification": "동시 요청 테스트에서 장기 대기와 deadlock이 재발하지 않고 데이터 정합성이 유지된다.",
      "rollback": "회귀나 정합성 오류가 발생하면 변경을 되돌리고 티켓을 재개한다.",
      "evidence_ids": ["PE-018", "PE-019"]
    }
  ],
  "agent_handling": {"allowed_outcomes": ["GUIDE_USER", "HANDOFF"], "handoff_reasons": ["INSUFFICIENT_EVIDENCE", "GUIDANCE_NOT_RESOLVED"], "prohibited_actions": ["CODE_CHANGE", "CONFIG_CHANGE", "DEPLOY", "RESTART", "DB_WRITE"], "resolution_confirmation_sources": ["USER_CONFIRMATION", "BACKEND_STATE"]},
  "verification": {
    "success_signals": ["blocker·waiter 관계가 해소된다.", "동일 동시성 시나리오에서 lock wait 또는 deadlock이 재발하지 않는다.", "사용자 요청과 데이터 정합성이 정상임을 확인한다."],
    "failure_signals": ["같은 blocker 또는 대기 패턴이 지속된다.", "deadlock detected 오류가 반복된다.", "재시도 후 중복 처리나 데이터 정합성 문제가 발생한다."]
  },
  "escalation": {
    "triggers": ["지속되는 lock wait 또는 deadlock 확인", "차단 세션을 안전하게 해소할 수 없음", "세션 종료·트랜잭션 또는 코드 변경이 필요함"],
    "target_department": "DB",
    "evidence_to_attach": ["발생 시각·X-Request-Id·API 경로 템플릿", "마스킹된 waiter·blocker 관계", "wait_event_type·lock granted·트랜잭션 상태", "deadlock 또는 lock wait 로그 지문", "재시도 안전성 여부"]
  },
  "user_response": {
    "safe_summary_template": "사내 포털의 데이터 처리 대기 문제를 확인하여 DB 담당 부서에서 점검 중입니다. 중복 저장을 피하고 요청 추적 번호 {request_id}를 보관해 주세요.",
    "prohibited_details": ["PID·사용자명·클라이언트 IP", "SQL 원문·바인딩 값", "잠금 대상 데이터 값", "세션 종료 명령", "근거 없이 특정 사용자를 blocker로 지목하는 표현"]
  },
  "provenance": {"source_type": "SYNTHESIZED_FROM_PUBLIC_EVIDENCE", "source_evidence_ids": ["PE-015", "PE-017", "PE-018", "PE-019", "PE-021", "PE-022", "PE-028"], "created_at": "2026-10-26"},
  "review": {"content_status": "OWNER_CONFIRMED", "reviewer": "DATA_OWNER", "reviewed_at": "2026-10-26", "team_review_status": "PENDING"}
}
